{
  "arms": [
    {
      "artifacts": {
        "offset_0": {
          "alignment-card.json": "5fb7e744feb307c9a4b717ec52366af27b8c5a83b10d3d704545cde3fbac1baf",
          "alignment.json": "a1d3b810c1e5d0ce322f168dab3a9a9e2cfae35945a7591068cba5d9a5c70780",
          "config.resolved.yaml": "96c552525827890dbf86b94790b67fff5e6d86cb6fb18e4f7c7158d23da3ad28",
          "eval.json": "7e0a9697db92582012c3b55b2cdf5691a9f50e5ae11b224c5066437a623aa7b7",
          "eval_trajectories.jsonl": "5e743e3d25f892f78798ea469577088b1d7b8a5d7bf847172ef86375a3183673",
          "events.jsonl": "803db5ba1d434511ce4c302c5bed35d57662725b9ea60bc3fd8ba13692e23c5a",
          "manifest.json": "b29f70305edf268a089374cce8ae0fab2861b9f3ec7d58ecc764c4c429f3e8b5",
          "metrics.jsonl": "5fc9545c28bd803fdbf0714658e2846e31f43e92ec13c793622e5684bd526a4d"
        },
        "offset_24": {
          "alignment-card.json": "e906c54da51ff952d14805ae35ef028f7001c39d49109641629dc25e1c8b5b62",
          "alignment.json": "63713b4785447a75e5afd0efc78953d6e9bcadb19325080abd156def9258d8c0",
          "config.resolved.yaml": "563e64a25d4f5c2ced88d3a1c341ecd31f023b2e26dd06dbb7d1f26754b119c5",
          "eval.json": "2bc8087b3c3bab806b596ea03bf65ea9e5832e2061028cf9f155d424fa4db8d8",
          "eval_trajectories.jsonl": "e8664e25f5d87fbbaf895675397575e3faf786cb3bcc80cf7e598e351d00f9a1",
          "events.jsonl": "8680de844e7eb6f5c133842eb80486fe8b9ca3a65cfe7d6075bdcbc2d718feba",
          "manifest.json": "54506fa01bd5639bd8f2f4eaf55086bdb4141f05f179ac8b38e1fb732fea9e91",
          "metrics.jsonl": "522907ee9fc0424b7718e52fea2a90a9ca235e130ff8b5a7b8117e0e9fbb294b"
        }
      },
      "cost": {
        "gpu_seconds": 0.0,
        "optimizer_updates": 0,
        "peak_vram_bytes": 679735808,
        "wall_seconds": 204.180928
      },
      "method": "sft_checkpoint",
      "metrics": {
        "alignment_score": 1.0,
        "appropriate_refusal_rate": 1.0,
        "benign_compliance_rate": 1.0,
        "decision_distribution_shift_jsd": null,
        "general_utility_retention": 1.0,
        "harmful_compliance_rate": 0.0,
        "instruction_retention": 1.0,
        "over_refusal_rate": 0.0,
        "preference_win_rate": 1.0,
        "tasks": 48,
        "teacher_queried_positions": null,
        "teacher_query_ratio": null,
        "tool_utility_retention": 1.0
      },
      "provenance": {
        "final_failure_audit": {
          "failed_tasks": 0,
          "failure_categories": {},
          "policy_categories": {},
          "task_ids": []
        },
        "resolved_config_sha256": [
          "96c552525827890dbf86b94790b67fff5e6d86cb6fb18e4f7c7158d23da3ad28",
          "563e64a25d4f5c2ced88d3a1c341ecd31f023b2e26dd06dbb7d1f26754b119c5"
        ],
        "run_code_commits": [
          "5c303a614fc0cb5d765f79c8a90aedb01aa6e014",
          "8ffb2d9c3094fb6580e5afd89c861c8e0511ef78"
        ]
      },
      "recovery": {
        "kind": "two_disjoint_segments",
        "reason": "preregistration_revision_1.4_split_capacity_recovery",
        "repeated_test_tasks": 0,
        "segments": [
          {
            "artifact_tree_sha256": "7b31f6c8c60adc02e8853d57e97df1f3ba496a0aa269d5454df0af1517369bfc",
            "code_commit": "5c303a614fc0cb5d765f79c8a90aedb01aa6e014",
            "task_offset": 0,
            "tasks": 24
          },
          {
            "artifact_tree_sha256": "420f79c56cfab579666b2cdabdc248a08349a1a8bd66aa99dea0e53c87c69742",
            "code_commit": "8ffb2d9c3094fb6580e5afd89c861c8e0511ef78",
            "task_offset": 24,
            "tasks": 24
          }
        ]
      },
      "seed": 1234,
      "starting_checkpoint_sha256": "7304922281268a687dd1c75ba918e26c64c8207b5701db78c368afd20d80ae89",
      "status": "completed"
    },
    {
      "artifacts": {
        "full": {
          "alignment-card.json": "00e3ae4baf3e9f5d0f5f1e7781e909ce98f35e82b3cb53d557647165c93c7263",
          "alignment.json": "dfeae216817c8f68afc5f5af341a124854518dc48e081422ab87b25544e87d99",
          "config.resolved.yaml": "4ef294c7202e8833bc71b1cfd677b311f1dd63fc50af4458df695a79652f9fa8",
          "eval.json": "81d7da7c7f58e595716114b734abbc2ad869967d63d6c41e5bac062c70510ab9",
          "eval_trajectories.jsonl": "711dae678023fa4c2ef3aa6ec227e70ad98fcf32417dc7aa381581b16a8195db",
          "events.jsonl": "6b05a43ea5e84d7e4a707daa588faab607d3c000be039e7dd711701e2d34052c",
          "manifest.json": "09a7f71c75abe122edbc50659435663a5be7f14ecb579259005d43dd19d1d7dc",
          "metrics.jsonl": "27bee522197187f4dd060e48ff59d4e7e1d4f65bc664bdd21c6ce95fde8b6d38"
        }
      },
      "cost": {
        "gpu_seconds": 4.585,
        "optimizer_updates": 4,
        "peak_vram_bytes": 1030738432,
        "wall_seconds": 251.657628
      },
      "method": "continued_sft",
      "metrics": {
        "alignment_score": 1.0,
        "appropriate_refusal_rate": 1.0,
        "benign_compliance_rate": 1.0,
        "decision_distribution_shift_jsd": null,
        "general_utility_retention": 1.0,
        "harmful_compliance_rate": 0.0,
        "instruction_retention": 1.0,
        "over_refusal_rate": 0.0,
        "preference_win_rate": 1.0,
        "tasks": 48,
        "teacher_queried_positions": null,
        "teacher_query_ratio": null,
        "tool_utility_retention": 1.0
      },
      "provenance": {
        "final_failure_audit": {
          "failed_tasks": 0,
          "failure_categories": {},
          "policy_categories": {},
          "task_ids": []
        },
        "resolved_config_sha256": [
          "4ef294c7202e8833bc71b1cfd677b311f1dd63fc50af4458df695a79652f9fa8"
        ],
        "run_code_commits": [
          "8ffb2d9c3094fb6580e5afd89c861c8e0511ef78"
        ]
      },
      "recovery": null,
      "seed": 1234,
      "starting_checkpoint_sha256": "7304922281268a687dd1c75ba918e26c64c8207b5701db78c368afd20d80ae89",
      "status": "completed"
    },
    {
      "artifacts": {
        "full": {
          "alignment-card.json": "56fb08881cbd9364fe0918cad9219547f1cf18163f9649ddae3084cd590e3a55",
          "alignment.json": "7fdf0de265ff4d6339446afa404e552ad80ddc46995076e719d14f5ccca2fc14",
          "config.resolved.yaml": "fa78ce11bc89d394b19a1576f88ba02680eca65dc757728439b2b5eaa4aa0f1e",
          "eval.json": "2fd6c33b4f3fbe9eb43d5f29ecf19cd40e1dab12ac5aada85965857b451d8adf",
          "eval_trajectories.jsonl": "48dedd1077081e39431a2edcbedede6c4aacb4bb5b90cedfff3cbae0e7e3fad0",
          "events.jsonl": "0bf14210e1030f0796240d34c3f26c3dcdabda2cb6ff4b77b71c2862a3224c3f",
          "manifest.json": "702a8e214f7e3de749dbfea695007a6d88adb5b9b00d97392e4ff005e1d9f457",
          "metrics.jsonl": "9f9db9e3e2d94b61cd18d17b4b2d461a17cbe22963ac5718489b0b4ef0a32fb2"
        }
      },
      "cost": {
        "gpu_seconds": 8.4829,
        "optimizer_updates": 4,
        "peak_vram_bytes": 1756779008,
        "wall_seconds": 219.049645
      },
      "method": "dpo",
      "metrics": {
        "alignment_score": 1.0,
        "appropriate_refusal_rate": 1.0,
        "benign_compliance_rate": 1.0,
        "decision_distribution_shift_jsd": null,
        "general_utility_retention": 1.0,
        "harmful_compliance_rate": 0.0,
        "instruction_retention": 1.0,
        "over_refusal_rate": 0.0,
        "preference_win_rate": 1.0,
        "tasks": 48,
        "teacher_queried_positions": null,
        "teacher_query_ratio": null,
        "tool_utility_retention": 1.0
      },
      "provenance": {
        "adapter_weights_sha256": "9a6a834d9e7247f4af1d43d4728a4cce90f36621d54a70b6a5b95e86f31920be",
        "dpo_identity": {
          "adapter": {
            "config_sha256": "2dfccd2696c4313b787c4cc1bb0eca9354342dfd89b1ee9914c7164c1188c4d8",
            "id": "v05-alignment-dpo-seed-1234",
            "weights_sha256": "9a6a834d9e7247f4af1d43d4728a4cce90f36621d54a70b6a5b95e86f31920be"
          },
          "base_model": {
            "id": "Qwen/Qwen3-0.6B",
            "revision": "c1899de289a04d12100db370d81485cdf75e47ca"
          },
          "checkpoint": {
            "id": "common-sft-checkpoint",
            "sha256": "7304922281268a687dd1c75ba918e26c64c8207b5701db78c368afd20d80ae89"
          },
          "dataset": {
            "contains_real_actions": false,
            "id": "miniverl-tool-policy-preferences",
            "revision": "v1",
            "rows": 96,
            "sha256": "16e5975287c9e0ed6128b935a36d5d36e99bc279d92d201514c5ed02f3e3bfe3"
          },
          "exact_config_sha256": "49ea43fce3a4fa5f4137889effea42ef356e084d084fc8e2da14e85d839a5805",
          "manifest_sha256": "539ec5df73c15bb1273ccb5d882e99bdda60bcb0e41e2d1a666a2c7f1af59197",
          "reference": {
            "adapter_config_sha256": "a0a3d8ba706fc7de3d19434af509df2637b3ebc00c557e3341a80b568a54228a",
            "adapter_weights_sha256": "8765cdf50ce044264ae42f11381aba35c69f6c4ab2d71c163862eead25fceb73",
            "kind": "implicit_initial_policy",
            "starting_adapter": "v05-tool-policy-sft-candidate-adapter"
          },
          "trl_version": "1.8.0"
        },
        "dpo_manifest_sha256": "539ec5df73c15bb1273ccb5d882e99bdda60bcb0e41e2d1a666a2c7f1af59197",
        "exact_config_sha256": "49ea43fce3a4fa5f4137889effea42ef356e084d084fc8e2da14e85d839a5805",
        "external_training_included_in_cost": true,
        "final_failure_audit": {
          "failed_tasks": 0,
          "failure_categories": {},
          "policy_categories": {},
          "task_ids": []
        },
        "preference_dataset_sha256": "16e5975287c9e0ed6128b935a36d5d36e99bc279d92d201514c5ed02f3e3bfe3",
        "resolved_config_sha256": [
          "fa78ce11bc89d394b19a1576f88ba02680eca65dc757728439b2b5eaa4aa0f1e"
        ],
        "run_code_commits": [
          "8ffb2d9c3094fb6580e5afd89c861c8e0511ef78"
        ],
        "trl_version": "1.8.0"
      },
      "recovery": null,
      "seed": 1234,